concept_id,korean,english,japanese,chinese,spanish
daily_hello_greeting,아침에 선생님께 안녕하세요라고 인사드렸어요,I greeted my teacher with hello in the morning,朝、先生にこんにちはと挨拶しました,早上我向老师问好,Por la mañana saludé a mi profesor con hola
food_apple_fruit,마트에서 신선한 사과를 골라서 샀어요,I picked and bought fresh apples at the mart,スーパーで新鮮なりんごを選んで買いました,我在超市挑选并购买了新鲜的苹果,Elegí y compré manzanas frescas en el supermercado
education_book_reading,도서관에서 새로운 소설책을 빌려왔어요,I borrowed a new novel from the library,図書館で新しい小説を借りてきました,我从图书馆借了一本新小说,Tomé prestada una nueva novela de la biblioteca
travel_train_transport,부산까지 KTX를 타고 갔어요,I went to Busan by taking the KTX,KTXに乗って釜山まで行きました,我坐KTX去了釜山,Fui a Busan tomando el KTX
daily_family_relative,주말에 가족들과 함께 영화를 보러 갔어요,I went to see a movie with my family on the weekend,週末に家族と一緒に映画を見に行きました,周末我和家人一起去看电影了,Fui a ver una película con mi familia el fin de semana
