concept_id,domain,category,difficulty,situation,purpose,korean_title,korean_structure,korean_description,korean_example,english_title,english_structure,english_description,english_example,japanese_title,japanese_structure,japanese_description,japanese_example,chinese_title,chinese_structure,chinese_description,chinese_example,spanish_title,spanish_structure,spanish_description,spanish_example,korean_word,english_word,japanese_word,chinese_word,spanish_word
nature_environment_surroundings,nature,environment,basic,"casual,public",description,환경 묘사하기,"N이/가 형용사다","환경의 특징을 형용사로 묘사하는 구조","이 환경이 정말 좋다.","Describing environment","N is adjective","Structure to describe environmental characteristics with adjectives","This environment is really good.","環境を描写する","Nが形容詞だ","環境の特徴を形容詞で描写する構造","この環境が本当に良い。","描述环境","N很形容词","用形容词描述环境特征的结构","这个环境很好。","Describir ambiente","N está adjective","Estructura para describir características ambientales con adjetivos","Este ambiente está muy bien.",환경,environment,環境,环境,ambiente
nature_air_atmosphere,nature,environment,basic,"polite,public",opinion,공기 상태 표현,"N이/가 어떻다","공기의 상태나 질을 표현하는 구조","공기가 맑다.","Expressing air condition","N is adjective","Structure to express air quality or condition","The air is clear.","空気の状態表現","Nがどうだ","空気の状態や質を表現する構造","空気がきれいだ。","表达空气状态","N很形容词","表达空气状态或质量的结构","空气很清新。","Expresar condición del aire","N está adjective","Estructura para expresar calidad o condición del aire","El aire está limpio.",공기,air,空気,空气,aire
nature_water_liquid,nature,environment,basic,"casual,home",description,물의 성질 설명,"N은/는 어떤 N이다","물의 특성이나 성질을 설명하는 구조","물은 생명의 근원이다.","Describing water properties","N is adjective N","Structure to describe water characteristics or properties","Water is the source of life.","水の性質説明","Nはどんなものだ","水の特性や性質を説明する構造","水は生命の源だ。","说明水的性质","N是形容词的N","说明水的特性或性质的结构","水是生命之源。","Describir propiedades del agua","N es adjective N","Estructura para describir características o propiedades del agua","El agua es la fuente de la vida.",물,water,水,水,agua
nature_soil_earth,nature,environment,intermediate,"polite,public",description,토양 특성 묘사,"N은/는 V기에 좋다","토양이 어떤 목적에 적합함을 표현하는 구조","이 토양은 농사짓기에 좋다.","Describing soil characteristics","N is good for V-ing","Structure to express soil suitability for certain purposes","This soil is good for farming.","土壌特性描写","NはVのに良い","土壌がある目的に適していることを表現する構造","この土壌は農業に良い。","描述土壤特性","N适合V","表达土壤适合某种目的的结构","这种土壤适合种植。","Describir características del suelo","N es bueno para V","Estructura para expresar la idoneidad del suelo para ciertos propósitos","Este suelo es bueno para cultivar.",토양,soil,土壌,土壤,suelo
nature_pollution_contamination,nature,environment,intermediate,"casual,public",emotion,오염 상태 표현,"N이/가 V어/아서 형용사다","오염의 원인과 결과를 연결하여 표현하는 구조","강이 오염되어서 더럽다.","Expressing pollution state","N is polluted so adjective","Structure to connect pollution cause and result","The river is polluted so it's dirty.","汚染状態表現","NがVて形容詞だ","汚染の原因と結果を結んで表現する構造","川が汚染されて汚い。","表达污染状态","N被V所以很形容词","连接污染原因和结果的表达结构","河水被污染所以很脏。","Expresar estado de contaminación","N está contaminado así que adjective","Estructura para conectar causa y resultado de contaminación","El río está contaminado así que está sucio.",오염,pollution,汚染,污染,contaminación
nature_recycling_reuse,nature,environment,intermediate,"polite,home",suggestion,재활용 권유하기,"V아/어 주세요","재활용 행동을 부탁하는 구조","분리수거를 해 주세요.","Encouraging recycling","Please V","Structure to request recycling actions","Please separate the waste.","リサイクル勧誘","Vてください","リサイクル行動をお願いする構造","分別収集をしてください。","鼓励回收","请V","请求回收行动的结构","请分类垃圾。","Alentar reciclaje","Por favor V","Estructura para solicitar acciones de reciclaje","Por favor separa la basura.",재활용,recycling,リサイクル,回收,reciclaje
nature_resource_material,nature,environment,intermediate,"polite,public",description,자원 중요성 표현,"N은/는 형용사기 때문에 V아/어야 한다","자원의 특성과 필요한 행동을 연결하는 구조","자원은 소중하기 때문에 아껴야 한다.","Expressing resource importance","N is adjective so we must V","Structure to connect resource characteristics with necessary actions","Resources are precious so we must conserve them.","資源重要性表現","Nは形容詞だからVべきだ","資源の特性と必要な行動を結ぶ構造","資源は大切だから節約すべきだ。","表达资源重要性","N很形容词所以必须V","连接资源特性与必要行动的结构","资源很宝贵所以必须节约。","Expresar importancia de recursos","N es adjective así que debemos V","Estructura para conectar características de recursos con acciones necesarias","Los recursos son preciosos así que debemos conservarlos.",자원,resource,資源,资源,recurso
nature_energy_power,nature,environment,basic,"casual,school",suggestion,에너지 활용 제안,"N로/으로 V을/를 수 있다","에너지 활용 방법을 제안하는 구조","태양으로 전기를 만들 수 있다.","Suggesting energy use","We can V with N","Structure to suggest energy utilization methods","We can generate electricity with the sun.","エネルギー活用提案","Nで V ができる","エネルギー活用方法を提案する構造","太陽で電気を作ることができる。","建议能源利用","用N可以V","建议能源利用方法的结构","用太阳能可以发电。","Sugerir uso de energía","Podemos V con N","Estructura para sugerir métodos de utilización de energía","Podemos generar electricidad con el sol.",에너지,energy,エネルギー,能源,energía
nature_waste_garbage,nature,environment,basic,"casual,home",emotion,쓰레기 문제 표현,"V으면/면 안 된다","쓰레기 처리에 대한 금지 표현 구조","쓰레기를 함부로 버리면 안 된다.","Expressing waste problems","We shouldn't V","Structure to express prohibition about waste disposal","We shouldn't throw away trash carelessly.","ゴミ問題表現","Vてはいけない","ゴミ処理に対する禁止表現構造","ごみを勝手に捨ててはいけない。","表达垃圾问题","不应该V","关于垃圾处理的禁止表达结构","不应该乱丢垃圾。","Expresar problemas de basura","No deberíamos V","Estructura para expresar prohibición sobre eliminación de basura","No deberíamos tirar basura descuidadamente.",쓰레기,waste,ゴミ,垃圾,basura
nature_forest_woods,nature,environment,basic,"polite,public",description,숲 상태 묘사,"N이/가 N로/으로 가득하다","숲의 풍부함을 표현하는 구조","숲이 나무로 가득하다.","Describing forest state","N is full of N","Structure to express forest abundance","The forest is full of trees.","森の状態描写","NがNでいっぱいだ","森の豊かさを表現する構造","森が木でいっぱいだ。","描述森林状态","N满是N","表达森林丰富性的结构","森林满是树木。","Describir estado del bosque","N está lleno de N","Estructura para expresar abundancia del bosque","El bosque está lleno de árboles.",숲,forest,森,森林,bosque
nature_river_stream,nature,environment,basic,"casual,public",description,강물 흐름 표현,"N에서 N이/가 V어/아 내리다","강의 물 흐름을 나타내는 구조","산에서 물이 흘러 내린다.","Expressing river flow","N flows down from N","Structure to indicate river water flow","Water flows down from the mountain.","川の流れ表現","NからNが流れる","川の水の流れを表す構造","山から水が流れる。","表达河流流动","N从N流下来","表示河水流动的结构","水从山上流下来。","Expresar flujo de río","N fluye desde N","Estructura para indicar flujo de agua del río","El agua fluye desde la montaña.",강,river,川,河流,río
nature_ocean_sea,nature,environment,basic,"polite,public",emotion,바다 크기 감탄,"N은/는 정말 형용사다!","바다의 크기나 아름다움에 대한 감탄 구조","바다는 정말 크다!","Exclaiming about ocean size","N is really adjective!","Structure to exclaim about ocean size or beauty","The ocean is really big!","海の大きさ感嘆","Nは本当に形容詞だ！","海の大きさや美しさに対する感嘆構造","海は本当に大きい！","感叹海洋大小","N真的很形容词！","对海洋大小或美丽的感叹结构","海洋真的很大！","Exclamar sobre tamaño del océano","¡N es realmente adjective!","Estructura para exclamar sobre tamaño o belleza del océano","¡El océano es realmente grande!",바다,ocean,海,海洋,océano
nature_mountain_peak,nature,environment,basic,"casual,public",emotion,산 높이 놀라움,"N이/가 얼마나 형용사은/ㄴ지!","산의 높이에 대한 놀라움을 표현하는 구조","산이 얼마나 높은지!","Mountain height amazement","How adjective N is!","Structure to express amazement about mountain height","How high the mountain is!","山の高さ驚き","Nがどんなに形容詞か！","山の高さに対する驚きを表現する構造","山がどんなに高いか！","惊叹山的高度","N有多么形容词！","表达对山高度惊叹的结构","山有多么高！","Asombro por altura de montaña","¡Qué adjective es N!","Estructura para expresar asombro por altura de montaña","¡Qué alta es la montaña!",산,mountain,山,山,montaña
nature_lake_pond,nature,environment,basic,"polite,home",description,호수 용도 설명,"N에서 V을/를 수 있다","호수 활용에 대한 설명 구조","호수에서 낚시를 할 수 있다.","Explaining lake usage","You can V in/at N","Structure to explain lake utilization","You can fish at the lake.","湖の用途説明","NでVことができる","湖の活用についての説明構造","湖で釣りをすることができる。","说明湖泊用途","可以在N V","说明湖泊利用的结构","可以在湖里钓鱼。","Explicar uso del lago","Puedes V en N","Estructura para explicar utilización del lago","Puedes pescar en el lago.",호수,lake,湖,湖泊,lago
nature_tree_plant,nature,environment,basic,"casual,home",description,나무 성장 묘사,"N이/가 V어/아서 V다","나무의 성장과 변화를 묘사하는 구조","나무가 자라서 크다.","Describing tree growth","N grows and becomes adjective","Structure to describe tree growth and changes","The tree grows and becomes big.","木の成長描写","NがVて形容詞になる","木の成長と変化を描写する構造","木が育って大きくなる。","描述树木生长","N长得很形容词","描述树木生长和变化的结构","树长得很大。","Describir crecimiento del árbol","N crece y se vuelve adjective","Estructura para describir crecimiento y cambios del árbol","El árbol crece y se vuelve grande.",나무,tree,木,树,árbol
nature_grass_vegetation,nature,environment,basic,"casual,public",description,풀의 움직임,"N이/가 N에 V고 있다","풀이 바람에 움직이는 모습을 표현하는 구조","풀이 바람에 흔들리고 있다.","Grass movement","N is V-ing in N","Structure to express grass moving in the wind","The grass is swaying in the wind.","草の動き","NがNでVている","草が風に動く様子を表現する構造","草が風に揺れている。","草的运动","N在N中V着","表达草在风中移动的结构","草在风中摇摆着。","Movimiento de hierba","N está V-ando en N","Estructura para expresar hierba moviéndose en el viento","La hierba está meciéndose en el viento.",풀,grass,草,草,hierba
nature_flower_bloom,nature,environment,basic,"polite,home",emotion,꽃 아름다움 감탄,"N이/가 얼마나 형용사은/ㄴ지 모르다","꽃의 아름다움에 대한 강한 감탄 구조","꽃이 얼마나 예쁜지 모른다.","Flower beauty exclamation","You don't know how adjective N is","Structure for strong exclamation about flower beauty","You don't know how beautiful the flowers are.","花の美しさ感嘆","Nがどんなに形容詞かわからない","花の美しさに対する強い感嘆構造","花がどんなに美しいかわからない。","感叹花的美丽","不知道N有多么形容词","对花朵美丽的强烈感叹结构","不知道花有多么美丽。","Exclamación por belleza de flor","No sabes qué tan adjective es N","Estructura para fuerte exclamación sobre belleza de flores","No sabes qué tan hermosas son las flores.",꽃,flower,花,花,flor
nature_clean_pure,nature,environment,basic,"polite,public",opinion,깨끗함 정도 표현,"N이/가 매우 형용사다","깨끗한 정도를 강조하여 표현하는 구조","공기가 매우 깨끗하다.","Expressing degree of cleanliness","N is very adjective","Structure to emphasize degree of cleanliness","The air is very clean.","きれいさ程度表現","Nがとても形容詞だ","きれいな程度を強調して表現する構造","空気がとてもきれいだ。","表达清洁程度","N非常形容词","强调清洁程度的表达结构","空气非常干净。","Expresar grado de limpieza","N está muy adjective","Estructura para enfatizar grado de limpieza","El aire está muy limpio.",깨끗한,clean,きれい,干净,limpio
nature_dirty_polluted,nature,environment,basic,"casual,public",emotion,더러움 원인 설명,"N 때문에 N이/가 형용사다","더러워진 원인을 설명하는 구조","공장 때문에 강이 더럽다.","Explaining cause of dirtiness","N is adjective because of N","Structure to explain cause of contamination","The river is dirty because of the factory.","汚れ原因説明","NのせいでNが形容詞だ","汚れた原因を説明する構造","工場のせいで川が汚い。","说明污脏原因","因为N所以N很形容词","说明污染原因的结构","因为工厂所以河水很脏。","Explicar causa de suciedad","N está adjective por N","Estructura para explicar causa de contaminación","El río está sucio por la fábrica.",더러운,dirty,汚い,脏,sucio
nature_protection_conservation,nature,environment,intermediate,"polite,school",suggestion,보호 필요성 강조,"N을/를 V아/어야 한다","환경 보호의 필요성을 강조하는 구조","자연을 보호해야 한다.","Emphasizing protection necessity","We must V N","Structure to emphasize environmental protection necessity","We must protect nature.","保護必要性強調","NをVべきだ","環境保護の必要性を強調する構造","自然を保護すべきだ。","强调保护必要性","必须V N","强调环境保护必要性的结构","必须保护自然。","Enfatizar necesidad de protección","Debemos V N","Estructura para enfatizar necesidad de protección ambiental","Debemos proteger la naturaleza.",보호,protection,保護,保护,protección
nature_climate_weather,nature,climate,intermediate,"polite,school",description,기후 변화 설명,"N 때문에 N이/가 V고 있다","기후 변화의 원인과 현상을 설명하는 구조","온난화 때문에 기후가 변하고 있다.","Explaining climate change","N is V-ing because of N","Structure to explain climate change causes and phenomena","The climate is changing because of warming.","気候変化説明","NのせいでNがVている","気候変化の原因と現象を説明する構造","温暖化のせいで気候が変わっている。","说明气候变化","因为N所以N在V着","说明气候变化原因和现象的结构","因为变暖所以气候在变化着。","Explicar cambio climático","N está V-ando por N","Estructura para explicar causas y fenómenos del cambio climático","El clima está cambiando por el calentamiento.",기후,climate,気候,气候,clima
nature_temperature_heat,nature,climate,basic,"casual,home",question,온도 묻기,"N이/가 몇 도인가요?","온도를 묻는 질문 구조","오늘 온도가 몇 도인가요?","Asking about temperature","What is the temperature of N?","Question structure to ask about temperature","What is today's temperature?","温度を聞く","Nは何度ですか？","温度を聞く質問構造","今日の温度は何度ですか？","询问温度","N是多少度？","询问温度的问句结构","今天温度是多少度？","Preguntar sobre temperatura","¿Cuál es la temperatura de N?","Estructura de pregunta para preguntar sobre temperatura","¿Cuál es la temperatura de hoy?",온도,temperature,温度,温度,temperatura
nature_humidity_moisture,nature,climate,intermediate,"polite,home",description,습도 변화 설명,"N에는 N이/가 V다","특정 시기의 습도 변화를 설명하는 구조","여름에는 습도가 올라간다.","Explaining humidity changes","N rises/falls in N","Structure to explain humidity changes in specific periods","Humidity rises in summer.","湿度変化説明","NにはNがVる","特定時期の湿度変化を説明する構造","夏には湿度が上がる。","说明湿度变化","N时N会V","说明特定时期湿度变化的结构","夏天时湿度会上升。","Explicar cambios de humedad","N sube/baja en N","Estructura para explicar cambios de humedad en períodos específicos","La humedad sube en verano.",습도,humidity,湿度,湿度,humedad
nature_rain_precipitation,nature,climate,basic,"casual,public",emotion,비에 대한 기쁨,"N이/가 V어/아서 형용사다","비가 와서 기쁜 감정을 표현하는 구조","비가 와서 기쁘다.","Joy about rain","I'm adjective because N V-ed","Structure to express happy emotions about rain","I'm happy because it rained.","雨への喜び","NがVて形容詞だ","雨が降って嬉しい感情を表現する構造","雨が降ってうれしい。","对雨的喜悦","因为N V了所以形容词","表达因下雨而高兴情感的结构","因为下雨了所以高兴。","Alegría por lluvia","Estoy adjective porque V N","Estructura para expresar emociones felices sobre lluvia","Estoy feliz porque llovió.",비,rain,雨,雨,lluvia
nature_snow_ice,nature,climate,basic,"polite,public",emotion,눈 내림 기쁨,"N이/가 V어/아서 N이/가 V다","눈이 와서 생기는 즐거운 활동을 표현하는 구조","눈이 와서 아이들이 좋아한다.","Snow falling joy","N is happy because N V-ed","Structure to express joyful activities from snowfall","Children are happy because it snowed.","雪降り喜び","NがVて Nが形容詞だ","雪が降って生じる楽しい活動を表現する構造","雪が降って子供たちが喜ぶ。","下雪的喜悦","因为N V了所以N很形容词","表达因下雪产生的快乐活动的结构","因为下雪了所以孩子们很高兴。","Alegría por nevada","N está feliz porque V N","Estructura para expresar actividades alegres por nevada","Los niños están felices porque nevó.",눈,snow,雪,雪,nieve
nature_wind_breeze,nature,climate,basic,"casual,public",emotion,바람의 효과,"N이/가 N을/를 V어/아 준다","바람이 주는 좋은 효과를 표현하는 구조","바람이 더위를 식혀 준다.","Wind's effect","N helps V N","Structure to express beneficial effects of wind","Wind helps cool the heat.","風の効果","NがNをVてくれる","風が与える良い効果を表現する構造","風が暑さを冷ましてくれる。","风的效果","N帮助V N","表达风带来良好效果的结构","风帮助缓解炎热。","Efecto del viento","N ayuda a V N","Estructura para expresar efectos beneficiosos del viento","El viento ayuda a enfriar el calor.",바람,wind,風,风,viento
nature_sun_star,nature,climate,basic,"polite,home",opinion,태양의 밝기,"N이/가 형용사어/아서 형용사다","태양의 밝기와 그로 인한 기분을 표현하는 구조","태양이 밝아서 기분이 좋다.","Sun's brightness","I feel adjective because N is adjective","Structure to express sun's brightness and resulting mood","I feel good because the sun is bright.","太陽の明るさ","Nが形容詞で形容詞だ","太陽の明るさとそれによる気分を表現する構造","太陽が明るくて気分が良い。","太阳的明亮","因为N很形容词所以很形容词","表达太阳明亮和由此产生心情的结构","因为太阳很明亮所以心情很好。","Brillo del sol","Me siento adjective porque N está adjective","Estructura para expresar brillo del sol y estado de ánimo resultante","Me siento bien porque el sol está brillante.",태양,sun,太陽,太阳,sol
nature_cloud_sky,nature,climate,basic,"casual,home",description,구름 모양 묘사,"N이/가 N을/를 만들다","구름이 다양한 모양을 만드는 모습을 표현하는 구조","구름이 동물 모양을 만든다.","Describing cloud shapes","N makes N shape","Structure to express clouds making various shapes","Clouds make animal shapes.","雲の形描写","NがNを作る","雲が様々な形を作る様子を表現する構造","雲が動物の形を作る。","描述云的形状","N做成N形状","表达云朵形成各种形状的结构","云做成动物形状。","Describir formas de nubes","N hace formas de N","Estructura para expresar nubes haciendo varias formas","Las nubes hacen formas de animales.",구름,cloud,雲,云,nube
nature_hot_burning,nature,climate,basic,"casual,public",emotion,뜨거움 정도 강조,"N이/가 V을/를 정도로 형용사다","극도로 뜨거운 정도를 강조하는 구조","모래가 발을 델 정도로 뜨겁다.","Emphasizing hotness degree","N is so adjective that it V","Structure to emphasize extreme hotness","The sand is so hot that it burns feet.","熱さ程度強調","NがVほど形容詞だ","極度に熱い程度を強調する構造","砂が足をやけどするほど熱い。","强调炎热程度","N热得足以V","强调极度炎热程度的结构","沙子热得足以烫伤脚。","Enfatizar grado de calor","N está tan adjective que V","Estructura para enfatizar calor extremo","La arena está tan caliente que quema los pies.",뜨거운,hot,熱い,热,caliente
nature_cold_freezing,nature,climate,basic,"polite,public",emotion,추위 정도 표현,"N이/가 V을/를 수 없을 정도로 형용사다","극도로 추운 정도를 표현하는 구조","바람이 견딜 수 없을 정도로 차갑다.","Expressing coldness degree","N is so adjective that you can't V","Structure to express extreme coldness","The wind is so cold that you can't bear it.","寒さ程度表現","NがVられないほど形容詞だ","極度に寒い程度を表現する構造","風が耐えられないほど寒い。","表达寒冷程度","N冷得让人无法V","表达极度寒冷程度的结构","风冷得让人无法忍受。","Expresar grado de frío","N está tan adjective que no puedes V","Estructura para expresar frío extremo","El viento está tan frío que no puedes soportarlo.",차가운,cold,寒い,冷,frío
nature_warm_mild,nature,climate,basic,"casual,home",opinion,따뜻함과 기분,"N이/가 형용사어/아서 형용사다","따뜻한 날씨와 좋은 기분을 연결하는 구조","날씨가 따뜻해서 기분이 좋다.","Warmth and mood","I feel adjective because N is adjective","Structure to connect warm weather and good mood","I feel good because the weather is warm.","暖かさと気分","Nが形容詞で形容詞だ","暖かい天気と良い気分を結ぶ構造","天気が暖かくて気分が良い。","温暖和心情","因为N很形容词所以很形容词","连接温暖天气和好心情的结构","因为天气很温暖所以心情很好。","Calidez y estado de ánimo","Me siento adjective porque N está adjective","Estructura para conectar clima cálido y buen humor","Me siento bien porque el clima está cálido.",따뜻한,warm,暖かい,温暖,cálido
nature_storm_tempest,nature,climate,intermediate,"polite,public",emotion,폭풍 후 상황,"N이/가 V은/ㄴ 후에 N이/가 V었/았다","폭풍 이후의 상황을 설명하는 구조","폭풍이 지나간 후에 나무가 쓰러졌다.","Post-storm situation","After N V-ed, N V-ed","Structure to describe post-storm situations","After the storm passed, trees fell down.","嵐後の状況","NがVた後でNがVた","嵐の後の状況を説明する構造","嵐が過ぎた後で木が倒れた。","暴风雨后情况","N V了之后N V了","描述暴风雨后情况的结构","暴风雨过了之后树倒了。","Situación post-tormenta","Después de que N V, N V","Estructura para describir situaciones post-tormenta","Después de que pasó la tormenta, los árboles se cayeron.",폭풍,storm,嵐,暴风雨,tormenta
