concept_id,domain,category,difficulty,situation,purpose,korean,english,japanese,chinese,spanish,korean_word,english_word,japanese_word,chinese_word,spanish_word
daily_bus_vehicle,daily,transportation,basic,"casual,public",question,"이 버스가 시청으로 가나요?","Does this bus go to city hall?","このバスは市役所に行きますか？","这班公交车去市政厅吗？","¿Este autobús va al ayuntamiento?",버스,bus,バス,公交车,autobús
daily_subway_train,daily,transportation,basic,"casual,public",request,"지하철 시간표를 알려주세요.","Please tell me the subway schedule.","地下鉄の時刻表を教えてください。","请告诉我地铁时刻表。","Por favor dígame el horario del metro.",지하철,subway,地下鉄,地铁,metro
daily_taxi_car,daily,transportation,basic,"polite,public",request,"공항까지 택시 요금이 얼마예요?","How much is the taxi fare to the airport?","空港までのタクシー料金はいくらですか？","到机场的出租车费是多少？","¿Cuánto cuesta el taxi al aeropuerto?",택시,taxi,タクシー,出租车,taxi
daily_train_railway,daily,transportation,intermediate,"casual,travel",instruction,"다음 기차는 오후 3시에 출발해요.","The next train departs at 3 PM.","次の電車は午後3時に出発します。","下一班火车下午3点出发。","El próximo tren sale a las 3 PM.",기차,train,電車,火车,tren
daily_bicycle_bike,daily,transportation,basic,"casual,home",suggestion,"자전거로 출근하면 건강에 좋아요.","Commuting by bicycle is good for health.","自転車で通勤すると健康にいいです。","骑自行车上班对健康有好处。","Ir al trabajo en bicicleta es bueno para la salud.",자전거,bicycle,自転車,自行车,bicicleta
daily_car_automobile,daily,transportation,basic,"casual,public",description,"우리 가족은 파란색 자동차가 있어요.","Our family has a blue car.","私たちの家族は青い車を持っています。","我们家有一辆蓝色汽车。","Nuestra familia tiene un coche azul.",자동차,car,車,汽车,coche
daily_airplane_aircraft,daily,transportation,intermediate,"polite,travel",emotion,"비행기에서 보는 경치가 환상적이에요!","The view from the airplane is fantastic!","飛行機からの景色は素晴らしいです！","从飞机上看到的景色太棒了！","¡La vista desde el avión es fantástica!",비행기,airplane,飛行機,飞机,avión
daily_motorcycle_bike,daily,transportation,intermediate,"casual,public",opinion,"오토바이는 교통체증을 피할 수 있어요.","Motorcycles can avoid traffic jams.","オートバイは交通渋滞を避けることができます。","摩托车可以避开交通堵塞。","Las motocicletas pueden evitar los atascos de tráfico.",오토바이,motorcycle,オートバイ,摩托车,motocicleta
daily_ship_boat,daily,transportation,intermediate,"polite,travel",description,"큰 배가 항구에 천천히 들어오고 있어요.","A large ship is slowly entering the port.","大きな船がゆっくりと港に入ってきています。","一艘大船正在慢慢驶入港口。","Un barco grande está entrando lentamente al puerto.",배,ship,船,船,barco
daily_truck_vehicle,daily,transportation,basic,"casual,work",instruction,"이사할 때 트럭을 빌려야 해요.","We need to rent a truck when moving.","引っ越しの時はトラックを借りる必要があります。","搬家时需要租一辆卡车。","Necesitamos alquilar un camión cuando nos mudemos.",트럭,truck,トラック,卡车,camión
daily_scooter_vehicle,daily,transportation,basic,"casual,public",suggestion,"전동스쿠터로 단거리 이동이 편해요.","Electric scooters are convenient for short distances.","電動スクーターは短距離移動に便利です。","电动滑板车适合短距离出行。","Los patinetes eléctricos son convenientes para distancias cortas.",스쿠터,scooter,スクーター,滑板车,patinete
daily_helicopter_aircraft,daily,transportation,advanced,"polite,travel",emotion,"헬리콥터 투어를 예약했어요!","I booked a helicopter tour!","ヘリコプターツアーを予約しました！","我预订了直升机观光！","¡Reservé un tour en helicóptero!",헬리콥터,helicopter,ヘリコプター,直升机,helicóptero
daily_ferry_boat,daily,transportation,intermediate,"polite,travel",instruction,"제주도 가는 페리는 밤 11시에 출발합니다.","The ferry to Jeju Island departs at 11 PM.","済州島行きのフェリーは夜11時に出発します。","去济州岛的渡船晚上11点出发。","El transbordador a la isla Jeju sale a las 11 PM.",페리,ferry,フェリー,渡船,transbordador
daily_skateboard_board,daily,transportation,basic,"casual,public",suggestion,"스케이트보드 연습을 위해 공원에 가요.","Let's go to the park to practice skateboard.","スケートボードの練習のために公園に行きましょう。","我们去公园练习滑板吧。","Vamos al parque a practicar monopatín.",스케이트보드,skateboard,スケートボード,滑板,monopatín
daily_rickshaw_cart,daily,transportation,advanced,"casual,travel",description,"관광지에서 인력거를 탔어요.","I rode a rickshaw at the tourist site.","観光地で人力車に乗りました。","我在旅游景点坐了人力车。","Monté en rickshaw en el sitio turístico.",인력거,rickshaw,人力車,人力车,rickshaw
daily_trolley_tram,daily,transportation,intermediate,"polite,public",question,"시내 관광 트롤리는 몇 시에 운행하나요?","What time does the city tour trolley operate?","市内観光トロリーは何時に運行しますか？","市内观光电车几点运营？","¿A qué hora opera el tranvía turístico de la ciudad?",트롤리,trolley,トロリー,电车,tranvía
daily_cable_car,daily,transportation,intermediate,"polite,travel",description,"케이블카를 타고 산 정상에 올라갔어요.","I went up to the mountain top by cable car.","ケーブルカーで山頂まで登りました。","我坐缆车上山顶了。","Subí a la cima de la montaña en teleférico.",케이블카,cable,ケーブルカー,缆车,teleférico
daily_segway_scooter,daily,transportation,advanced,"casual,public",suggestion,"세그웨이 투어에 참가해보세요.","Try joining a Segway tour.","セグウェイツアーに参加してみてください。","试试参加平衡车观光吧。","Intenta unirte a un tour en Segway.",세그웨이,segway,セグウェイ,平衡车,segway
daily_kayak_boat,daily,transportation,intermediate,"casual,travel",emotion,"강에서 카약을 타는 경험이 잊을 수 없어요!","The experience of kayaking on the river is unforgettable!","川でカヤックに乗る体験は忘れられません！","在河上划皮划艇的经历难忘！","¡La experiencia de hacer kayak en el río es inolvidable!",카약,kayak,カヤック,皮划艇,kayak
daily_hoverboard_board,daily,transportation,advanced,"casual,public",opinion,"호버보드 타는 법을 배우고 싶어요.","I want to learn how to ride a hoverboard.","ホバーボードの乗り方を習いたいです。","我想学骑平衡板。","Quiero aprender a montar hoverboard.",호버보드,hoverboard,ホバーボード,平衡板,hoverboard
daily_station_place,daily,location,basic,"casual,public",question,"가장 가까운 지하철역이 어디예요?","Where is the nearest subway station?","一番近い地下鉄駅はどこですか？","最近的地铁站在哪里？","¿Dónde está la estación de metro más cercana?",역,station,駅,车站,estación
daily_airport_place,daily,location,intermediate,"polite,travel",instruction,"공항에 2시간 전에 도착하세요.","Arrive at the airport 2 hours early.","空港に2時間前に到着してください。","请提前2小时到达机场。","Llegue al aeropuerto 2 horas antes.",공항,airport,空港,机场,aeropuerto
daily_port_harbor,daily,location,intermediate,"polite,travel",description,"항구에서 신선한 바닷바람을 느꼈어요.","I felt the fresh sea breeze at the port.","港で新鮮な海風を感じました。","我在港口感受到了新鲜的海风。","Sentí la brisa marina fresca en el puerto.",항구,port,港,港口,puerto
daily_bridge_structure,daily,location,basic,"casual,public",description,"이 다리는 100년 전에 지어졌어요.","This bridge was built 100 years ago.","この橋は100年前に建てられました。","这座桥是100年前建造的。","Este puente fue construido hace 100 años.",다리,bridge,橋,桥,puente
daily_tunnel_passage,daily,location,intermediate,"casual,public",instruction,"터널 안에서는 속도를 줄이세요.","Reduce speed inside the tunnel.","トンネル内では速度を落としてください。","在隧道内请减速。","Reduzca la velocidad dentro del túnel.",터널,tunnel,トンネル,隧道,túnel
daily_intersection_crossing,daily,location,basic,"casual,public",question,"이 교차로에서 좌회전할 수 있나요?","Can I turn left at this intersection?","この交差点で左折できますか？","在这个十字路口可以左转吗？","¿Puedo girar a la izquierda en esta intersección?",교차로,intersection,交差点,十字路口,intersección
daily_parking_area,daily,location,basic,"casual,public",request,"무료 주차장이 어디에 있어요?","Where is the free parking lot?","無料駐車場はどこにありますか？","免费停车场在哪里？","¿Dónde está el aparcamiento gratuito?",주차장,parking,駐車場,停车场,aparcamiento
daily_sidewalk_path,daily,location,basic,"casual,public",instruction,"안전을 위해 인도로 걸으세요.","Walk on the sidewalk for safety.","安全のために歩道を歩いてください。","为了安全请走人行道。","Camina por la acera por seguridad.",인도,sidewalk,歩道,人行道,acera
daily_crosswalk_crossing,daily,location,basic,"polite,public",instruction,"신호등이 파란불일 때 횡단보도를 건너세요.","Cross the crosswalk when the light is green.","信号が青の時に横断歩道を渡ってください。","绿灯时请过人行横道。","Cruza el paso de peatones cuando la luz esté verde.",횡단보도,crosswalk,横断歩道,人行横道,paso
daily_square_plaza,daily,location,intermediate,"polite,public",description,"도심 광장에서 문화행사가 열려요.","Cultural events are held in the city square.","都心の広場で文化行事が開かれます。","市中心广场举办文化活动。","Se celebran eventos culturales en la plaza de la ciudad.",광장,square,広場,广场,plaza
daily_corner_position,daily,location,basic,"casual,public",question,"이 모퉁이에서 어느 방향으로 가야 해요?","Which direction should I go from this corner?","この角からどの方向に行けばいいですか？","从这个拐角应该往哪个方向走？","¿En qué dirección debo ir desde esta esquina?",모퉁이,corner,角,拐角,esquina
daily_entrance_door,daily,location,basic,"polite,public",instruction,"건물 정면 입구로 들어오세요.","Please enter through the front entrance of the building.","建物の正面入口から入ってください。","请从建筑物正门入口进入。","Por favor entre por la entrada principal del edificio.",입구,entrance,入口,入口,entrada
daily_exit_door,daily,location,basic,"polite,public",instruction,"비상시에는 가장 가까운 출구를 이용하세요.","In an emergency, use the nearest exit.","緊急時は最も近い出口をご利用ください。","紧急情况下请使用最近的出口。","En caso de emergencia, use la salida más cercana.",출구,exit,出口,出口,salida
daily_platform_station,daily,location,intermediate,"polite,public",question,"서울행 기차는 몇 번 승강장에서 출발해요?","Which platform does the train to Seoul depart from?","ソウル行きの電車は何番ホームから出発しますか？","去首尔的火车从几号站台出发？","¿Desde qué andén sale el tren a Seúl?",승강장,platform,ホーム,站台,andén
daily_escalator_stairs,daily,location,basic,"casual,public",instruction,"짐이 많으니 에스컬레이터를 이용하세요.","Since you have a lot of luggage, use the escalator.","荷物が多いのでエスカレーターをご利用ください。","行李很多，请使用自动扶梯。","Como tienes mucho equipaje, usa la escalera mecánica.",에스컬레이터,escalator,エスカレーター,自动扶梯,escalera
daily_elevator_lift,daily,location,basic,"polite,public",request,"5층까지 엘리베이터로 올라가주세요.","Please go up to the 5th floor by elevator.","エレベーターで5階まで上がってください。","请坐电梯到5楼。","Por favor suba al 5º piso en ascensor.",엘리베이터,elevator,エレベーター,电梯,ascensor
daily_restroom_bathroom,daily,location,basic,"polite,public",question,"이 층에 화장실이 있나요?","Is there a restroom on this floor?","この階にトイレはありますか？","这一层有洗手间吗？","¿Hay un baño en este piso?",화장실,restroom,トイレ,洗手间,baño
daily_information_desk,daily,location,intermediate,"polite,public",question,"관광 정보를 얻으려면 안내소에 가야 해요?","Should I go to the information desk to get tourist information?","観光情報を得るには案内所に行くべきですか？","要获取旅游信息应该去咨询台吗？","¿Debo ir al mostrador de información para obtener información turística?",안내소,information,案内所,咨询台,información
daily_ticket_office,daily,location,basic,"polite,public",request,"매표소에서 오늘 오후 공연 티켓을 살 수 있어요?","Can I buy tickets for today's afternoon show at the ticket office?","切符売り場で今日の午後の公演チケットを買えますか？","可以在售票处买今天下午演出的票吗？","¿Puedo comprar boletos para el espectáculo de esta tarde en la taquilla?",매표소,ticket,切符売り場,售票处,taquilla
daily_food_court,daily,location,intermediate,"casual,shopping",suggestion,"쇼핑몰 푸드코트에서 점심 먹을까요?","Shall we have lunch at the shopping mall food court?","ショッピングモールのフードコートで昼食を食べましょうか？","我们在购物中心美食广场吃午饭吧？","¿Almorzamos en el patio de comidas del centro comercial?",푸드코트,food,フードコート,美食广场,patio
daily_north_direction,daily,direction,basic,"casual,public",instruction,"학교는 여기서 북쪽으로 500미터예요.","The school is 500 meters north from here.","学校はここから北に500メートルです。","学校在这里往北500米。","La escuela está a 500 metros al norte de aquí.",북쪽,north,北,北,norte
daily_south_direction,daily,direction,basic,"casual,public",instruction,"해변으로 가려면 남쪽으로 계속 가세요.","To get to the beach, keep going south.","海岸に行くには南にずっと行ってください。","要去海滩请继续往南走。","Para llegar a la playa, sigue hacia el sur.",남쪽,south,南,南,sur
daily_east_direction,daily,direction,basic,"casual,public",instruction,"태양이 동쪽에서 떠올라요.","The sun rises in the east.","太陽は東から昇ります。","太阳从东方升起。","El sol sale por el este.",동쪽,east,東,东,este
daily_west_direction,daily,direction,basic,"casual,public",instruction,"공원은 서쪽 방향에 있어요.","The park is in the west direction.","公園は西の方向にあります。","公园在西边方向。","El parque está en dirección oeste.",서쪽,west,西,西,oeste
daily_left_direction,daily,direction,basic,"casual,public",instruction,"신호등에서 왼쪽으로 돌아요.","Turn left at the traffic light.","信号で左に曲がります。","在红绿灯处向左转。","Gira a la izquierda en el semáforo.",왼쪽,left,左,左,izquierda
daily_right_direction,daily,direction,basic,"casual,public",instruction,"편의점은 오른쪽에 있어요.","The convenience store is on the right.","コンビニは右にあります。","便利店在右边。","La tienda de conveniencia está a la derecha.",오른쪽,right,右,右,derecha
daily_straight_direction,daily,direction,basic,"casual,public",instruction,"이 길로 직진하면 역이 나와요.","If you go straight on this road, you'll reach the station.","この道をまっすぐ行くと駅が出てきます。","沿着这条路直走就到车站了。","Si vas recto por esta carretera, llegarás a la estación.",직진,straight,直進,直行,recto
daily_backward_direction,daily,direction,basic,"casual,public",instruction,"잘못 왔으니 뒤로 돌아가야 해요.","We came the wrong way, so we need to go back.","間違って来たので後ろに戻らなければなりません。","走错了，需要往后退。","Vinimos por el camino equivocado, así que necesitamos volver atrás.",뒤로,backward,後ろ,后退,atrás
daily_forward_direction,daily,direction,basic,"casual,public",instruction,"목적지까지 계속 앞으로 가세요.","Keep going forward to the destination.","目的地まで前に進み続けてください。","继续向前走到目的地。","Sigue adelante hasta el destino.",앞으로,forward,前,向前,adelante
daily_upward_direction,daily,direction,basic,"casual,public",instruction,"산 정상까지 위로 올라가요.","Let's go up to the mountain top.","山頂まで上に登りましょう。","我们上山顶去。","Vamos hacia arriba hasta la cima de la montaña.",위로,upward,上,向上,arriba
daily_downward_direction,daily,direction,basic,"casual,public",instruction,"계단을 따라 아래로 내려가세요.","Go down the stairs.","階段に沿って下に降りてください。","沿着楼梯往下走。","Baja por las escaleras.",아래로,downward,下,向下,abajo
daily_around_direction,daily,direction,intermediate,"casual,public",instruction,"건물 주변을 한 바퀴 돌아보세요.","Take a walk around the building.","建物の周りを一周してみてください。","绕着建筑物转一圈看看。","Da una vuelta alrededor del edificio.",주변,around,周り,周围,alrededor
daily_beyond_direction,daily,direction,intermediate,"polite,public",description,"강 너머에 아름다운 마을이 보여요.","I can see a beautiful village beyond the river.","川の向こうに美しい村が見えます。","河那边可以看到一个美丽的村庄。","Puedo ver un pueblo hermoso más allá del río.",너머,beyond,向こう,那边,más