concept_id,domain,category,difficulty,situation,purpose,korean_title,korean_structure,korean_description,korean_example,english_title,english_structure,english_description,english_example,japanese_title,japanese_structure,japanese_description,japanese_example,chinese_title,chinese_structure,chinese_description,chinese_example,spanish_title,spanish_structure,spanish_description,spanish_example,korean_word,english_word,japanese_word,chinese_word,spanish_word
nature_season_period,nature,climate,intermediate,"polite,school",description,계절 나열하기,"N에는 N, N, N, N이/가 있다","계절을 순서대로 나열하는 구조","한국에는 봄, 여름, 가을, 겨울이 있다.","Listing seasons","N has N, N, N, and N","Structure to list seasons in order","Korea has spring, summer, autumn, and winter.","季節列挙","Nには N、N、N、Nがある","季節を順序良く列挙する構造","韓国には春、夏、秋、冬がある。","列举季节","N有N、N、N、N","按顺序列举季节的结构","韩国有春、夏、秋、冬。","Enumerar estaciones","N tiene N, N, N y N","Estructura para enumerar estaciones en orden","Corea tiene primavera, verano, otoño e invierno.",계절,season,季節,季节,estación
nature_drought_dryness,nature,climate,advanced,"casual,public",description,가뭄 영향 설명,"N으로/로 인해 N이/가 V었/았다","가뭄이 미치는 영향을 설명하는 구조","가뭄으로 인해 강물이 줄어들었다.","Explaining drought effects","N decreased due to N","Structure to explain drought impacts","River water decreased due to drought.","干ばつ影響説明","NによりNがVた","干ばつが与える影響を説明する構造","干ばつにより川の水が減った。","说明干旱影响","由于N所以N V了","说明干旱影响的结构","由于干旱所以河水减少了。","Explicar efectos de sequía","N disminuyó debido a N","Estructura para explicar impactos de sequía","El agua del río disminuyó debido a la sequía.",가뭄,drought,干ばつ,干旱,sequía
nature_flood_overflow,nature,climate,advanced,"polite,public",emotion,홍수 피해 표현,"N으로/로 인해 N이/가 V게 되었다","홍수로 인한 피해를 표현하는 구조","홍수로 인해 집이 물에 잠기게 되었다.","Expressing flood damage","N became V-ed due to N","Structure to express flood damage","Houses became flooded due to flood.","洪水被害表現","NによりNがVようになった","洪水による被害を表現する構造","洪水により家が水に浸かるようになった。","表达洪水损害","由于N所以N变得V了","表达洪水损害的结构","由于洪水所以房屋变得被淹了。","Expresar daño por inundación","N se volvió V debido a N","Estructura para expresar daño por inundación","Las casas se volvieron inundadas debido a la inundación.",홍수,flood,洪水,洪水,inundación
nature_frost_ice,nature,climate,intermediate,"casual,public",description,서리 형성 과정,"N으로/로 인해 N이/가 V다","서리가 형성되는 과정을 설명하는 구조","추위로 인해 서리가 내린다.","Frost formation process","N forms due to N","Structure to explain frost formation process","Frost forms due to cold.","霜形成過程","NによりNができる","霜が形成される過程を説明する構造","寒さにより霜ができる。","霜形成过程","由于N所以N形成","说明霜形成过程的结构","由于寒冷所以霜形成。","Proceso de formación de escarcha","N se forma debido a N","Estructura para explicar proceso de formación de escarcha","La escarcha se forma debido al frío.",서리,frost,霜,霜,escarcha
nature_tsunami_wave,nature,climate,advanced,"polite,public",emotion,쓰나미 충격 표현,"N은/는 N에게 N을/를 주었다","쓰나미가 준 충격을 표현하는 구조","쓰나미는 사람들에게 충격을 주었다.","Expressing tsunami shock","N gave N to people","Structure to express shock given by tsunami","Tsunami gave shock to people.","津波衝撃表現","NはNにNを与えた","津波が与えた衝撃を表現する構造","津波は人々に衝撃を与えた。","表达海啸冲击","N给N带来了N","表达海啸带来冲击的结构","海啸给人们带来了冲击。","Expresar impacto de tsunami","N dio N a la gente","Estructura para expresar impacto dado por tsunami","El tsunami dio shock a la gente.",쓰나미,tsunami,津波,海啸,tsunami
nature_wildlife_animals,nature,ecosystem,basic,"polite,public",description,야생동물 관찰,"N에서 N을/를 V을/를 수 있다","야생동물 관찰 장소와 활동을 표현하는 구조","사파리에서 야생동물을 볼 수 있다.","Wildlife observation","You can V N in N","Structure to express wildlife observation places and activities","You can see wildlife in safari.","野生動物観察","NでNをVることができる","野生動物観察場所と活動を表現する構造","サファリで野生動物を見ることができる。","观察野生动物","可以在N V N","表达野生动物观察地点和活动的结构","可以在野生动物园观察野生动物。","Observación de vida silvestre","Puedes V N en N","Estructura para expresar lugares y actividades de observación de vida silvestre","Puedes ver vida silvestre en safari.",야생동물,wildlife,野生動物,野生动物,vida silvestre
nature_habitat_home,nature,ecosystem,intermediate,"polite,school",description,서식지 감소 문제,"N의 N이/가 V고 있다","동물 서식지 감소 문제를 표현하는 구조","판다의 서식지가 줄어들고 있다.","Habitat reduction problem","N's N is V-ing","Structure to express animal habitat reduction problem","Pandas' habitat is decreasing.","生息地減少問題","NのNがVている","動物の生息地減少問題を表現する構造","パンダの生息地が減っている。","栖息地减少问题","N的N在V着","表达动物栖息地减少问题的结构","熊猫的栖息地在减少着。","Problema de reducción de hábitat","N de N está V-ando","Estructura para expresar problema de reducción de hábitat animal","El hábitat de pandas está disminuyendo.",서식지,habitat,生息地,栖息地,hábitat
nature_biodiversity_variety,nature,ecosystem,intermediate,"polite,school",opinion,생물다양성 가치,"N은/는 N의 N이다","생물다양성의 가치를 표현하는 구조","생물다양성은 지구의 보물이다.","Biodiversity value","N is N's N","Structure to express biodiversity value","Biodiversity is Earth's treasure.","生物多様性価値","NはNのNだ","生物多様性の価値を表現する構造","生物多様性は地球の宝物だ。","生物多样性价值","N是N的N","表达生物多样性价值的结构","生物多样性是地球的宝藏。","Valor de biodiversidad","N es N de N","Estructura para expresar valor de biodiversidad","La biodiversidad es tesoro de la Tierra.",생물다양성,biodiversity,生物多様性,生物多样性,biodiversidad
nature_ecosystem_system,nature,ecosystem,intermediate,"polite,school",suggestion,생태계 보호 권유,"N을/를 V기 위해 V아/어야 한다","생태계 보호를 위한 행동을 권유하는 구조","생태계를 보호하기 위해 노력해야 한다.","Ecosystem protection recommendation","We should V to V N","Structure to recommend actions for ecosystem protection","We should work to protect ecosystems.","生態系保護勧誘","NをVためにVべきだ","生態系保護のための行動を勧誘する構造","生態系を保護するために努力すべきだ。","建议生态系统保护","为了V N应该V","建议生态系统保护行动的结构","为了保护生态系统应该努力。","Recomendación de protección de ecosistema","Deberíamos V para V N","Estructura para recomendar acciones para protección de ecosistema","Deberíamos trabajar para proteger ecosistemas.",생태계,ecosystem,生態系,生态系统,ecosistema
nature_extinction_disappearance,nature,ecosystem,advanced,"casual,public",emotion,멸종 시기 설명,"N은/는 N 전에 V었/았다","멸종이 일어난 시기를 설명하는 구조","공룡은 오래 전에 멸종했다.","Explaining extinction timing","N became extinct N ago","Structure to explain extinction timing","Dinosaurs became extinct long ago.","絶滅時期説明","NはN前にVた","絶滅が起きた時期を説明する構造","恐竜は昔に絶滅した。","说明灭绝时期","N在N前V了","说明灭绝发生时期的结构","恐龙在很久前灭绝了。","Explicar momento de extinción","N se extinguió hace N","Estructura para explicar momento de extinción","Los dinosaurios se extinguieron hace mucho.",멸종,extinction,絶滅,灭绝,extinción
nature_food_chain,nature,ecosystem,intermediate,"polite,school",instruction,먹이사슬 역할 설명,"N에서 각 N의 N을/를 V는 것이 형용사다","먹이사슬에서 각 생물의 역할 중요성을 설명하는 구조","먹이사슬에서 각 생물의 역할을 아는 것이 중요하다.","Food chain role explanation","It's adjective to V each N's N in N","Structure to explain importance of each organism's role in food chain","It's important to know each organism's role in food chain.","食物連鎖役割説明","Nで各NのNをVることが形容詞だ","食物連鎖での各生物の役割の重要性を説明する構造","食物連鎖で各生物の役割を知ることが重要だ。","说明食物链作用","在N中V每个N的N很形容词","说明食物链中各生物作用重要性的结构","在食物链中了解每个生物的作用很重要。","Explicación del papel en cadena alimentaria","Es adjective V el N de cada N en N","Estructura para explicar importancia del papel de cada organismo en cadena alimentaria","Es importante conocer el papel de cada organismo en cadena alimentaria.",먹이사슬,food chain,食物連鎖,食物链,cadena alimentaria
nature_predator_hunter,nature,ecosystem,intermediate,"casual,public",description,포식자 특성 설명,"N은/는 N으로/로 유명하다","포식자의 특성을 설명하는 구조","독수리는 강한 포식자로 유명하다.","Predator characteristic description","N is famous as adjective N","Structure to describe predator characteristics","Eagles are famous as strong predators.","捕食者特性説明","NはNとして有名だ","捕食者の特性を説明する構造","ワシは強い捕食者として有名だ。","说明捕食者特性","N以N而闻名","说明捕食者特性的结构","老鹰以强大的捕食者而闻名。","Descripción de características de depredador","N es famoso como N adjective","Estructura para describir características de depredador","Las águilas son famosas como depredadores fuertes.",포식자,predator,捕食者,捕食者,depredador
nature_prey_victim,nature,ecosystem,basic,"polite,public",description,피식자 역할 설명,"N은/는 N의 형용사한 N이다","피식자의 역할을 설명하는 구조","토끼는 여러 동물의 중요한 피식자다.","Prey role description","N is adjective N for N","Structure to describe prey role","Rabbits are important prey for various animals.","被食者役割説明","NはNの形容詞なNだ","被食者の役割を説明する構造","ウサギは様々な動物の重要な被食者だ。","说明被食者作用","N是N的形容词N","说明被食者作用的结构","兔子是各种动物的重要猎物。","Descripción del papel de presa","N es N adjective para N","Estructura para describir papel de presa","Los conejos son presas importantes para varios animales.",피식자,prey,被食者,被食者,presa
nature_species_type,nature,ecosystem,intermediate,"polite,school",description,종의 다양성 설명,"N에는 형용사한 N이/가 V고 있다","특정 지역의 종 다양성을 설명하는 구조","이 섬에는 독특한 종이 살고 있다.","Species diversity description","adjective N lives in N","Structure to describe species diversity in specific regions","Unique species live on this island.","種の多様性説明","Nには形容詞なNが住んでいる","特定地域の種の多様性を説明する構造","この島には独特な種が住んでいる。","说明物种多样性","N中生活着形容词的N","说明特定地区物种多样性的结构","这个岛上生活着独特的物种。","Descripción de diversidad de especies","N adjective vive en N","Estructura para describir diversidad de especies en regiones específicas","Especies únicas viven en esta isla.",종,species,種,物种,especie
nature_balance_equilibrium,nature,ecosystem,intermediate,"polite,school",agreement,균형 중요성 동의,"모든 N이/가 N에 동의하다","생태계 균형의 중요성에 대한 동의를 표현하는 구조","모든 사람이 균형의 중요성에 동의한다.","Balance importance agreement","Everyone agrees on N of N","Structure to express agreement on ecosystem balance importance","Everyone agrees on importance of balance.","バランス重要性同意","すべてのNがNに同意する","生態系バランスの重要性への同意を表現する構造","すべての人がバランスの重要性に同意する。","同意平衡重要性","所有N都同意N的重要性","表达对生态系统平衡重要性同意的结构","所有人都同意平衡的重要性。","Acuerdo sobre importancia del equilibrio","Todos están de acuerdo en N de N","Estructura para expresar acuerdo sobre importancia del equilibrio del ecosistema","Todos están de acuerdo en importancia del equilibrio.",균형,balance,バランス,平衡,equilibrio
nature_pollution_environmental,nature,ecosystem,advanced,"casual,public",instruction,환경오염 예방법,"N을/를 V기 위해서는 N을/를 V아/어야 한다","환경오염 예방 방법을 제시하는 구조","환경오염을 줄이기 위해서는 플라스틱을 적게 써야 한다.","Environmental pollution prevention","To V N, we must V N","Structure to suggest environmental pollution prevention methods","To reduce environmental pollution, we must use less plastic.","環境汚染予防法","NをVためにはNをVべきだ","環境汚染予防方法を提示する構造","環境汚染を減らすためにはプラスチックを少なく使うべきだ。","环境污染预防方法","为了V N必须V N","提出环境污染预防方法的结构","为了减少环境污染必须少用塑料。","Prevención de contaminación ambiental","Para V N, debemos V N","Estructura para sugerir métodos de prevención de contaminación ambiental","Para reducir contaminación ambiental, debemos usar menos plástico.",환경오염,environmental pollution,環境汚染,环境污染,contaminación ambiental
nature_conservation_preservation,nature,ecosystem,intermediate,"polite,school",agreement,보전 중요성 공감,"모든 N이/가 N의 중요성에 동의했다","자연 보전 중요성에 대한 공감을 표현하는 구조","모든 학생이 보전의 중요성에 동의했다.","Conservation importance consensus","All N agreed on importance of N","Structure to express consensus on nature conservation importance","All students agreed on importance of conservation.","保全重要性共感","すべてのNがNの重要性に同意した","自然保全の重要性への共感を表現する構造","すべての学生が保全の重要性に同意した。","认同保护重要性","所有N都同意N的重要性","表达对自然保护重要性认同的结构","所有学生都同意保护的重要性。","Consenso sobre importancia de conservación","Todos N estuvieron de acuerdo en importancia de N","Estructura para expresar consenso sobre importancia de conservación natural","Todos estudiantes estuvieron de acuerdo en importancia de conservación.",보전,conservation,保全,保护,conservación