concept_id,domain,category,difficulty,situation,purpose,korean_title,korean_structure,korean_description,korean_example,english_title,english_structure,english_description,english_example,japanese_title,japanese_structure,japanese_description,japanese_example,chinese_title,chinese_structure,chinese_description,chinese_example,spanish_title,spanish_structure,spanish_description,spanish_example,korean_word,english_word,japanese_word,chinese_word,spanish_word
daily_evening_time,daily,routine,basic,"home,casual",description,저녁 시간 표현,저녁에 + 동사,저녁 시간과 활동 표현,저녁에 가족과 시간을 보냅니다,Evening Time Expression,In the evening + verb,Expression for evening time and activities,I spend time with family in the evening,夕方時間表現,夕方に + 動詞,夕方の時間と活動表現,夕方に家族と時間を過ごします,晚间时间表达,晚上 + 动词,晚上时间和活动的表达,我晚上和家人度过时间,Expresión de tiempo vespertino,Por la tarde + verbo,Expresión para tiempo vespertino y actividades,Paso tiempo con la familia por la tarde,저녁,evening,夕方,晚上,tarde
daily_weekend_leisure,daily,leisure,basic,"casual,home",description,주말 표현,주말에 + 동사,주말과 여가 활동 표현,주말에 영화를 봅니다,Weekend Expression,On weekend + verb,Expression for weekend and leisure activities,I watch movies on weekends,週末表現,週末に + 動詞,週末と余暇活動表現,週末に映画を見ます,周末表达,周末 + 动词,周末和休闲活动的表达,我周末看电影,Expresión de fin de semana,En fin de semana + verbo,Expresión para fin de semana y actividades de ocio,Veo películas los fines de semana,주말,weekend,週末,周末,fin de semana
daily_happiness_emotion,daily,emotions,intermediate,"social,casual",emotion,행복 표현,행복을 + 동사,행복과 기쁨을 나타내는 표현,행복을 마음껏 느낍니다,Happiness Expression,Happiness + verb,Expression showing happiness and joy,I feel happiness to the fullest,幸せ表現,幸せを + 動詞,幸せと喜びを表す表現,幸せを心から感じます,幸福表达,幸福 + 动词,表示幸福和喜悦的表达,我尽情地感受幸福,Expresión de felicidad,Felicidad + verbo,Expresión que muestra felicidad y alegría,Siento felicidad al máximo,행복,happiness,幸せ,幸福,felicidad
daily_stress_emotion,daily,emotions,intermediate,"work,formal",emotion,스트레스 표현,스트레스를 + 동사,스트레스와 압박감 표현,스트레스를 잘 관리합니다,Stress Expression,Stress + verb,Expression for stress and pressure,I manage stress well,ストレス表現,ストレスを + 動詞,ストレスと圧迫感表現,ストレスをよく管理します,压力表达,压力 + 动词,压力和紧张感的表达,我很好地管理压力,Expresión de estrés,Estrés + verbo,Expresión para estrés y presión,Manejo el estrés bien,스트레스,stress,ストレス,压力,estrés
daily_tired_feeling,daily,emotions,basic,"casual,home",emotion,피로 표현,피곤할 때 + 동사,피로와 지침을 나타내는 표현,피곤할 때 충분히 쉽니다,Tiredness Expression,When tired + verb,Expression showing fatigue and exhaustion,I rest sufficiently when tired,疲労表現,疲れた時 + 動詞,疲労と疲れを表す表現,疲れた時十分に休みます,疲劳表达,累的时候 + 动词,表示疲劳和疲倦的表达,累的时候我充分休息,Expresión de cansancio,Cuando cansado + verbo,Expresión que muestra fatiga y agotamiento,Descanso suficientemente cuando estoy cansado,피곤,tired,疲れた,累,cansado
daily_hungry_feeling,daily,emotions,basic,"casual,home",emotion,배고픔 표현,배고플 때 + 동사,배고픔과 식욕 표현,배고플 때 음식을 먹습니다,Hunger Expression,When hungry + verb,Expression for hunger and appetite,I eat food when hungry,空腹表現,お腹がすいた時 + 動詞,空腹と食欲表現,お腹がすいた時食べ物を食べます,饥饿表达,饿的时候 + 动词,饥饿和食欲的表达,饿的时候我吃食物,Expresión de hambre,Cuando hambriento + verbo,Expresión para hambre y apetito,Como comida cuando tengo hambre,배고픔,hunger,空腹,饿,hambre
daily_thirsty_feeling,daily,emotions,basic,"casual,home",emotion,목마름 표현,목마를 때 + 동사,목마름과 갈증 표현,목마를 때 물을 마십니다,Thirst Expression,When thirsty + verb,Expression for thirst and dehydration,I drink water when thirsty,喉の渇き表現,喉が渇いた時 + 動詞,喉の渇きと渇きの表現,喉が渇いた時水を飲みます,口渴表达,渴的时候 + 动词,口渴和干渴的表达,渴的时候我喝水,Expresión de sed,Cuando sediento + verbo,Expresión para sed y deshidratación,Bebo agua cuando tengo sed,목마름,thirst,喉の渇き,渴,sed
daily_cold_weather,daily,weather_talk,basic,"casual,public",description,추위 표현,추울 때 + 동사,추위와 한랭감 표현,추울 때 따뜻한 옷을 입습니다,Cold Expression,When cold + verb,Expression for coldness and chill,I wear warm clothes when cold,寒さ表現,寒い時 + 動詞,寒さと寒冷感表現,寒い時暖かい服を着ます,寒冷表达,冷的时候 + 动词,寒冷和严寒感的表达,冷的时候我穿暖和的衣服,Expresión de frío,Cuando frío + verbo,Expresión para frialdad y fresco,Uso ropa abrigada cuando hace frío,추위,cold,寒さ,冷,frío
daily_hot_weather,daily,weather_talk,basic,"casual,public",description,더위 표현,더울 때 + 동사,더위와 열감 표현,더울 때 시원한 곳을 찾습니다,Heat Expression,When hot + verb,Expression for heat and warmth,I look for cool places when hot,暑さ表現,暑い時 + 動詞,暑さと熱感表現,暑い時涼しい所を探します,炎热表达,热的时候 + 动词,炎热和热感的表达,热的时候我找凉快的地方,Expresión de calor,Cuando caluroso + verbo,Expresión para calor y calidez,Busco lugares frescos cuando hace calor,더위,heat,暑さ,热,calor
daily_rain_weather,daily,weather_talk,basic,"casual,public",description,비 표현,비가 올 때 + 동사,비와 강수 표현,비가 올 때 우산을 씁니다,Rain Expression,When raining + verb,Expression for rain and precipitation,I use an umbrella when raining,雨表現,雨が降る時 + 動詞,雨と降水表現,雨が降る時傘を使います,下雨表达,下雨的时候 + 动词,下雨和降水的表达,下雨的时候我用雨伞,Expresión de lluvia,Cuando llueve + verbo,Expresión para lluvia y precipitación,Uso paraguas cuando llueve,비,rain,雨,雨,lluvia
daily_sun_weather,daily,weather_talk,basic,"casual,public",description,햇빛 표현,해가 날 때 + 동사,햇빛과 맑은 날씨 표현,해가 날 때 밖에서 놉니다,Sunshine Expression,When sunny + verb,Expression for sunshine and clear weather,I play outside when sunny,太陽表現,晴れた時 + 動詞,太陽と晴天表現,晴れた時外で遊びます,阳光表达,晴天的时候 + 动词,阳光和晴朗天气的表达,晴天的时候我在外面玩,Expresión de sol,Cuando soleado + verbo,Expresión para sol y clima despejado,Juego afuera cuando está soleado,해,sun,太陽,太阳,sol
